Id,Title,Subreddit,Author,Upvotes,Created_At,Sentiment,Url,Is_Original_Content,Word_Count,Last_Updated
1gr5tyr,Satire publication The Onion buys Alex Jones’ Infowars at auction with help from Sandy Hook families,technology,intelw1zard,36938,2024-11-14 19:51:35,0.0,https://apnews.com/article/onion-buys-infowars-alex-jones-6496f198d141c991087dcd937b3588e9,0,16,2024-11-21 12:31:29
1grouaq,Rupee crosses 84 mark | Art by Alok,INDIA,mangoes_love,2465,2024-11-15 10:31:30,0.0,https://i.redd.it/6agj9r99zz0e1.jpeg,0,8,2024-11-21 12:38:58
1grv1g8,"Stephen King leaves X, describing atmosphere as ""too toxic""",technology,RunDNA,50318,2024-11-15 17:46:09,0.0,https://www.theguardian.com/books/2024/nov/15/stephen-king-quits-x-atmosphere-too-toxic,0,9,2024-11-21 12:31:24
1grvh3r,Why isn’t India more outraged by Narayana Murthy’s constant elitist statements?,INDIA,RaulStark,2776,2024-11-15 18:11:20,-0.133333,https://www.reddit.com/r/india/comments/1grvh3r/why_isnt_india_more_outraged_by_narayana_murthys/,0,11,2024-11-21 12:38:55
1gtdsrh,Lowkey flex ,btechtards,uncharted_17,2374,2024-11-17 19:11:34,0.0,https://i.redd.it/0apovh3vtg1e1.jpeg,0,2,2024-11-21 12:50:43
1guuz43,My Final year Major Project,btechtards,StonerSensei,3143,2024-11-19 16:56:07,0.03125,https://i.redd.it/6hs3onvifu1e1.png,0,5,2024-11-21 12:50:42
1gvk0ta,Suggest some best resources and YT channel for 3rd sem ,btech,Saksham_152,2,2024-11-20 12:47:45,0.5,/r/Btechtards/comments/1gvjzua/suggest_some_best_resources_and_yt_channel_for/,0,10,2024-11-21 12:34:34
1gw95b3,The complete calculas formulas sheet..!,btech,Gracious_Heart_,2,2024-11-21 11:09:50,0.125,https://www.reddit.com/gallery/1gw95b3,0,5,2024-11-21 12:34:34
